{
 "schema": 1,
 "note": "Кассиры Salad Story (W-02, research/12_salad_story.md §2.2, §7 п. 1): без сюжета, только манера. Реплики [типично]: обычная речь кассы в польском фастфуде, сверить с Шэфом. ask[ключ] кассира заменяет common[ключ]; вариант с minLevel — только с этого уровня. Подстановки: {salad} {dressing} {size} {price} {item} (генератор, src/wola/systems/saladVisit.ts).",
 "common": {
  "greet": [
   { "pl": "Dzień dobry, co podać?", "ru": "Здравствуйте, что подать?" },
   { "pl": "Dzień dobry! Co dla pana?", "ru": "Здравствуйте! Что для вас?" },
   { "pl": "Dzień dobry, słucham?", "ru": "Здравствуйте, слушаю вас." },
   { "pl": "Słucham pana?", "ru": "Слушаю вас?", "minLevel": 6 }
  ],
  "serve": [
   { "pl": "Proszę. Smacznego!", "ru": "Пожалуйста. Приятного аппетита!" },
   { "pl": "Proszę bardzo. Smacznego!", "ru": "Пожалуйста. Приятного аппетита!" }
  ],
  "name": [
   { "pl": "Sałatka {salad}. Proszę. Smacznego!", "ru": "Салат {salad}. Пожалуйста. Приятного аппетита!" }
  ],
  "q.rozmiar": [{ "pl": "Normalna czy powiększona?", "ru": "Обычная или увеличенная?" }],
  "q.dressing": [{ "pl": "Dressing {dressing}, może być?", "ru": "Заправка {dressing}, подойдёт?" }],
  "q.jaki_dressing": [{ "pl": "Jaki dressing?", "ru": "Какую заправку?" }],
  "q.osobno": [{ "pl": "Dressing osobno czy wymieszać?", "ru": "Заправку отдельно или перемешать?" }],
  "q.paluch": [{ "pl": "Paluch do tego?", "ru": "Хлебную палочку к этому?" }],
  "q.paluch_jaki": [{ "pl": "Buraczkowy czy z ziarnami?", "ru": "Свекольную или с семенами?" }],
  "q.picie": [{ "pl": "Coś do picia?", "ru": "Что-нибудь попить?" }],
  "q.miejsce": [{ "pl": "Na miejscu czy na wynos?", "ru": "Здесь или с собой?" }],
  "q.cos_jeszcze": [{ "pl": "Czy coś jeszcze?", "ru": "Что-нибудь ещё?" }, { "pl": "Coś jeszcze?", "ru": "Что-то ещё?" }, { "pl": "Coś poza tym?", "ru": "Что-нибудь кроме этого?" }],
  "q.ze_wszystkim": [{ "pl": "Ze wszystkim?", "ru": "Со всем?" }],
  "q.baza": [{ "pl": "Jaka baza?", "ru": "Какая основа?" }],
  "q.bialko": [{ "pl": "Jakie białko?", "ru": "Какой белок?" }],
  "q.dodatki": [{ "pl": "Jakie dodatki?", "ru": "Какие добавки?" }],
  "q.aplikacja": [{ "pl": "Ma pan aplikację?", "ru": "У вас есть приложение?" }],
  "q.platnosc": [{ "pl": "Kartą?", "ru": "Картой?" }, { "pl": "Kartą czy BLIKiem?", "ru": "Картой или BLIKом?" }],
  "q.paragon": [{ "pl": "Paragon?", "ru": "Чек?" }],
  "razem": [{ "pl": "Razem {price}.", "ru": "Итого {priceRu}." }],
  "jak_bylo": [{ "pl": "I jak było?", "ru": "Ну как, получилось заказать по-настоящему?" }],
  "co_zwykle": [{ "pl": "To co zwykle? Sałatka {salad}?", "ru": "Как обычно? Салат {salad}?" }],
  "nie_ma": [{ "pl": "Niestety, dziś nie ma sałatki {salad}.", "ru": "К сожалению, сегодня нет салата {salad}." }],
  "nie_ma_item": [{ "pl": "Niestety, nie ma {item}.", "ru": "К сожалению, {itemRu} нет." }],
  "powtorka": [{ "pl": "Czyli sałatka {salad}, {size}, dressing {mix}. Zgadza się?", "ru": "Итак: салат {salad}, {sizeRu}, заправка {mixRu}. Верно?" }],
  "compose": [{ "pl": "Stwórz własną? Proszę bardzo.", "ru": "Собрать свой? Пожалуйста." }]
 },
 "cashiers": [
  {
   "id": "kasjerka_ola",
   "name": "Ola",
   "tempo": "fast",
   "sprite": "wola.kasjer/0",
   "about": "быстро, одним словом: материал для «Proszę wolniej»",
   "ask": {
    "greet": [{ "pl": "Co podać?", "ru": "Что подать?" }, { "pl": "Dzień dobry, co podać?", "ru": "Здравствуйте, что подать?" }],
    "q.rozmiar": [{ "pl": "Normalna czy powiększona?", "ru": "Обычная или увеличенная?" }, { "pl": "Powiększona?", "ru": "Увеличенная?", "minLevel": 6 }],
    "q.osobno": [{ "pl": "Dressing osobno czy wymieszać?", "ru": "Заправку отдельно или перемешать?" }, { "pl": "Osobno?", "ru": "Отдельно?", "minLevel": 6 }]
   }
  },
  {
   "id": "kasjer_bartek",
   "name": "Pan Bartek",
   "tempo": "slow",
   "sprite": "wola.kasjer/1",
   "about": "медленно и подробно",
   "ask": {
    "greet": [{ "pl": "Dzień dobry! Co dla pana dzisiaj?", "ru": "Здравствуйте! Что для вас сегодня?" }],
    "q.dressing": [{ "pl": "Do tego dressing {dressing}, może być?", "ru": "К этому заправка {dressing}, подойдёт?" }],
    "q.osobno": [{ "pl": "Dressing podać osobno czy wymieszać?", "ru": "Заправку подать отдельно или перемешать?" }]
   }
  },
  {
   "id": "kasjerka_ela",
   "name": "Pani Ela",
   "tempo": "normal",
   "sprite": "wola.kasjer/2",
   "about": "всегда про приложение и чек",
   "ask": {
    "q.aplikacja": [{ "pl": "Ma pan aplikację?", "ru": "У вас есть приложение?" }, { "pl": "Zbiera pan punkty?", "ru": "Собираете баллы?" }],
    "q.paragon": [{ "pl": "Paragon potrzebny?", "ru": "Чек нужен?" }]
   }
  },
  {
   "id": "kasjer_kuba",
   "name": "Kuba",
   "tempo": "normal",
   "sprite": "wola.kasjer/3",
   "about": "эллипсис живой речи",
   "ask": {
    "q.osobno": [{ "pl": "Dressing osobno czy wymieszać?", "ru": "Заправку отдельно или перемешать?" }, { "pl": "Sos osobno?", "ru": "Соус отдельно?", "minLevel": 5 }],
    "q.paluch": [{ "pl": "Paluch do tego?", "ru": "Хлебную палочку к этому?" }, { "pl": "Paluch?", "ru": "Палочку?", "minLevel": 6 }],
    "q.miejsce": [{ "pl": "Na miejscu czy na wynos?", "ru": "Здесь или с собой?" }, { "pl": "Na wynos?", "ru": "С собой?", "minLevel": 6 }]
   }
  }
 ]
}
